{"$schema":"https://json-schema.org/draft/2020-12/schema","type":"object","properties":{"version":{"type":"string","const":"v1"},"license":{"type":"string","const":"CC BY 4.0"},"list":{"type":"string"},"id":{"type":"string"},"title":{"type":"string"},"intro":{"type":"string"},"page":{"type":"string","format":"uri"},"updated":{"type":"string","pattern":"^\\d{4}-\\d{2}-\\d{2}$"},"projects":{"type":"array","items":{"type":"object","properties":{"id":{"type":"string","description":"<list>/<project>, stable across renames"},"name":{"type":"string"},"url":{"type":"string","format":"uri","description":"API document of the project"},"page":{"type":"string","format":"uri","description":"Project page on the site"},"place":{"type":"integer","exclusiveMinimum":0,"maximum":9007199254740991,"description":"Place in its category"},"score":{"type":"number","minimum":0,"maximum":100},"tagline":{"type":"string"},"source_url":{"type":"string","format":"uri","description":"Canonical page to cite and link"},"checked_at":{"anyOf":[{"type":"string","pattern":"^\\d{4}-\\d{2}-\\d{2}$"},{"type":"null"}],"description":"Date of the GitHub check behind the facts; null when the latest check missed the repo"}},"required":["id","name","url","page","place","score","tagline","source_url","checked_at"],"additionalProperties":false},"description":"Every project in the category, ranked"}},"required":["version","license","list","id","title","intro","page","updated","projects"],"additionalProperties":false}