{"version":"v1","license":"CC BY 4.0","list":"best-of-ai","id":"vector-db","title":"Vector databases","intro":"Vector stores and hybrid search engines for embeddings.","page":"https://archestack.com/best-of-ai/vector-db/","updated":"2026-10-14","projects":[{"id":"best-of-ai/milvus","name":"Milvus","url":"https://archestack.com/api/v1/projects/best-of-ai/milvus.json","page":"https://archestack.com/best-of-ai/projects/milvus/","place":1,"score":80,"tagline":"Distributed vector database with dense, sparse and hybrid search at scale","source_url":"https://archestack.com/best-of-ai/projects/milvus/","checked_at":"2026-10-14"},{"id":"best-of-ai/meilisearch","name":"Meilisearch","url":"https://archestack.com/api/v1/projects/best-of-ai/meilisearch.json","page":"https://archestack.com/best-of-ai/projects/meilisearch/","place":2,"score":74,"tagline":"Rust search engine API with full-text, vector and hybrid search","source_url":"https://archestack.com/best-of-ai/projects/meilisearch/","checked_at":"2026-10-14"},{"id":"best-of-ai/qdrant","name":"Qdrant","url":"https://archestack.com/api/v1/projects/best-of-ai/qdrant.json","page":"https://archestack.com/best-of-ai/projects/qdrant/","place":3,"score":67,"tagline":"Rust vector database with payload filtering, REST and gRPC","source_url":"https://archestack.com/best-of-ai/projects/qdrant/","checked_at":"2026-10-14"},{"id":"best-of-ai/weaviate","name":"Weaviate","url":"https://archestack.com/api/v1/projects/best-of-ai/weaviate.json","page":"https://archestack.com/best-of-ai/projects/weaviate/","place":4,"score":62,"tagline":"Go vector database with built-in vectorizers, hybrid search and RAG","source_url":"https://archestack.com/best-of-ai/projects/weaviate/","checked_at":"2026-10-14"},{"id":"best-of-ai/helix-db","name":"HelixDB","url":"https://archestack.com/api/v1/projects/best-of-ai/helix-db.json","page":"https://archestack.com/best-of-ai/projects/helix-db/","place":5,"score":62,"tagline":"Rust graph database with native vector and BM25 search","source_url":"https://archestack.com/best-of-ai/projects/helix-db/","checked_at":"2026-10-14"},{"id":"best-of-ai/chroma","name":"Chroma","url":"https://archestack.com/api/v1/projects/best-of-ai/chroma.json","page":"https://archestack.com/best-of-ai/projects/chroma/","place":6,"score":60,"tagline":"Embedding database with a four-function API for Python and JavaScript","source_url":"https://archestack.com/best-of-ai/projects/chroma/","checked_at":"2026-10-14"},{"id":"best-of-ai/pgvector","name":"pgvector","url":"https://archestack.com/api/v1/projects/best-of-ai/pgvector.json","page":"https://archestack.com/best-of-ai/projects/pgvector/","place":7,"score":58,"tagline":"PostgreSQL extension for vector similarity search with HNSW and IVFFlat","source_url":"https://archestack.com/best-of-ai/projects/pgvector/","checked_at":"2026-10-14"},{"id":"best-of-ai/vespa","name":"Vespa","url":"https://archestack.com/api/v1/projects/best-of-ai/vespa.json","page":"https://archestack.com/best-of-ai/projects/vespa/","place":8,"score":44,"tagline":"Serving engine for vectors, tensors, text and ML ranking at scale","source_url":"https://archestack.com/best-of-ai/projects/vespa/","checked_at":"2026-10-14"}]}